{
  "schema_version": "1.0",
  "report": {
    "title": "A Small Product Flow",
    "slug": "sample-product",
    "scope": "repo",
    "target": "sample checkout",
    "commit": "abc1234",
    "written_at": "2026-09-24",
    "audience": "new developer"
  },
  "product": {
    "purpose": "The product turns a submitted request into a validated result.",
    "boundaries": ["It does not own upstream identity."],
    "outcomes": ["A user receives a validated result."],
    "inputs": ["A request"],
    "outputs": ["A result or an actionable error"]
  },
  "decisions": [
    {
      "topic": "Explanation shape",
      "selected": "Trace one real request",
      "alternatives": ["Inventory every module"],
      "rationale": "A real flow connects product purpose to implementation."
    }
  ],
  "sources": [
    {"label": "README", "kind": "documented", "location": "README.md:1"},
    {"label": "entrypoint", "kind": "code-confirmed", "location": "src/app.py:12"}
  ],
  "research": [
    {
      "topic": "Flow visual",
      "candidates": ["Inline SVG", "External diagram library"],
      "selected_pattern": "Inline SVG",
      "rejected_patterns": ["External diagram library"],
      "rationale": "The page must work offline.",
      "sources": ["README"]
    }
  ],
  "sections": [
    {"id": "background", "title": "Catch-up", "summary": "What the product does.", "body": "A user submits a request. The product validates it and returns a result.", "sources": ["README"]},
    {"id": "intuition", "title": "The Gist", "summary": "The central mechanism.", "body": "Validation turns an untrusted request into a result the product can safely use.", "sources": ["entrypoint"]},
    {"id": "architecture", "title": "How It Fits Together", "summary": "The main responsibilities.", "body": "The entrypoint accepts the request. The validator checks it. The result layer returns the outcome.", "sources": ["entrypoint"]},
    {"id": "dataflow", "title": "Follow the Data", "summary": "One request from input to output.", "body": "Request -> validation -> result.", "sources": ["entrypoint"]},
    {"id": "code", "title": "In the Code", "summary": "The implementation path.", "body": "The entrypoint receives the request and passes it to validation before producing the result.", "sources": ["entrypoint"]},
    {"id": "quiz", "title": "Prove It", "summary": "Check the reasoning.", "body": "Use the questions below to test the flow.", "sources": ["entrypoint"]}
  ],
  "quiz": {
    "questions": [
      {"id": "q1", "prompt": "Which boundary protects the result?", "type": "single", "options": ["Validation", "Decoration", "Logging"], "correct": [0], "feedback": "Validation is the step that checks the request before the result is produced.", "source": "entrypoint"},
      {"id": "q2", "prompt": "Which statements describe the product flow?", "type": "multi", "options": ["A request enters", "Validation runs", "An unrelated report is generated"], "correct": [0, 1], "feedback": "The flow begins with a request and includes validation; the unrelated report is not part of this path.", "source": "entrypoint"}
    ]
  },
  "validation": {"checks": [], "unknowns": []}
}
